{
 "id": "常法卷",
 "attachment": "附件4",
 "renumber": true,
 "items": [
  {
   "code": 1,
   "name": "法律顾问合同（合同编号、经办律师签字、落款时间必填）",
   "required": true,
   "keywords": [
    "法律顾问合同",
    "顾问合同",
    "常年法律顾问",
    "聘书",
    "续聘书"
   ],
   "folders": []
  },
  {
   "code": 2,
   "name": "收费发票凭证（如为计时收费，请一并上传计时收费确认单）",
   "required": true,
   "keywords": [
    "发票",
    "收费",
    "律师费",
    "顾问费"
   ],
   "folders": []
  },
  {
   "code": 3,
   "name": "办理各类法律事务的记录和有关材料（如起草规章、审查合同、参与谈判、代理解决纠纷、提供法律建议或法律意见、咨询或代书等）",
   "required": true,
   "keywords": [
    "法律意见",
    "审查合同",
    "咨询记录",
    "工作记录",
    "简报",
    "法律建议"
   ],
   "folders": []
  },
  {
   "code": 4,
   "name": "终止/解除协议",
   "required": false,
   "keywords": [
    "终止协议",
    "解除协议",
    "解约"
   ],
   "folders": []
  },
  {
   "code": 5,
   "name": "结案报告",
   "required": true,
   "keywords": [
    "结案报告",
    "工作小结",
    "年度总结"
   ],
   "folders": [],
   "generated": true
  }
 ]
}
